age,gender,condition,rating,review_long,review_short
[' 55-64 |  '],[' Male |  '],[' Condition: Other '],[' Overall rating 4.0 '],[],['I have been using nose drops for many years because of my sinus problems. My nose stopped up every night when I went to bed. I use Zyrtec now and have not had to use the nose drops in more than a month. I can breath all day without problem. I take it at night and it works great. I love it.']
[' 35-44 |  '],[' Female |  '],[' Condition: Other '],[' Overall rating 1.0 '],"['I started using this because for some reason I have developed new sensitivities to our cats. Have always had season allergies but have taken Claritin. Dr. said try zyrtec for this. This med was awful to me.  To begin with I was not sure it was the meds because of just becoming so sensitive to new things.  But while on this medication I started having chest pains, my breathing became more difficult. Not like asthmatic, I could just tell a difference, dizzy, nauseated. Very mild to start. Thought ', ""it was related to my newly acquired allergies. Oh yeh, for some reason my voice kept getting more hoarse and deeper.  At some times I really had to push myself to get sound to come out. At the 1 week point of being on this med, it hit me hard.     about 30 to 45 min after I took it my chest started cramping bad. It kept getting worse and worse, It got harder to breath. dizzy, every so often I would get a warm flush feeling. Got so bad I went to E.R. everything came back fine. Around the 24 hour point, time for it to wear off, my chest started easing up, no more warm flushes, not dizzy. And within 24 hours of stopping taking zyrtec and taking Claritin in it's place, I started coughing up all kinds of mess and my breathing started getting better. purchasing Zyrtec was the worse thing that ever happened to me. ""]",[]
[' 35-44 |  '],[' Female |  '],[' Condition: Seasonal Runny Nose '],[' Overall rating 3.0 '],[],"['I have been taking zyrtec every day for the last 4 mos. It did eliminate my allergy symptoms, but I started having really bad headaches every day. I also noticed that my sinuses felt very dry. I ended up with a sinus infection and had to take prednisone to relieve the inflammation in my sinus cavities. I had my 8 yr old daughter on it also and she started complaining with bad headaches. We no longer use zyrtec.']"
[' 7-12 |  '],[' Male |  '],[' Condition: Atopic Dermatitis '],[' Overall rating 1.0 '],"[""My 10 year old son was taking Zyrtec everyday for 18 months for eczema symptoms. It worked great on his skin.  But...he  gained a lot of weight, he was hungry (starving) all of the time.  He would yell I'm hungry from his bead in the morning & wanted to eat until bedtime.  He was tired no matter how much sleep he got.  He was fatigued and did not want to be very active or couldn't be physically active for very long without tiring.  He was irritable and very emotional/depressed.  The symptoms cam"", 'e on gradually over the summer, so we thought it was some kind of growing issue.  I read online that Zyrtec can cause major depression in kids, so he stopped taking it.  Within days we saw drastic changes.  He was not as hungry & he said ""Mom I don\'t feel so sad inside anymore.""  He has been off the meds for 6 months, has lost almost all of the fat that he put on (it was cellulite-like fat), he\'s happier & he\'s full of energy & playing outside a lot!  He had a bad skin flare up a few months ago, so I gave him 1 pill thinking that it would clear the skin, but no side effects would show up from that 1 pill.  The next morning, he yelled from his bed, I\'m hungry!  Then, he cried & said how stressed out he was before school.  NEVER again will he take Zyrtec.  We reported this to his dermatologist who told us that he actually does clinical studies for Zyrtec & he had never heard anything like this.  I think it\'s because it comes on so gradual in the beginning that you don\'t even know that it is the medicine that is effecting your child so negatively.  If your child gets heavy & doesn\'t want to do anything anymore & feels sad, take him off Zyrtec & see what happens.']",[]
[' 45-54 |  '],[' Male |  '],[' Condition: Other '],[' Overall rating 3.0 '],[],['The drug seems too weak to combat my hayfever symptoms (itchy eyes). Piriton does a better job on this but causes more drowsiness.']
[' 35-44 |  '],[' Female |  '],[' Condition: Hives '],[' Overall rating 4.7 '],[],['I developed urticaria in my teens.  My allergic reaction is hives due to extreme heat or highly stressful situations.  I love that I only have to take one and it not only takes care of the hivs but my other seasonal allergies.  Only drawback is the occasional drowsiness.  I just take it closer to bed time and its good for 24 hours.']
[' 55-64 |  '],[' Female |  '],[' Condition: Other '],[' Overall rating 4.7 '],[],"[""There are very few allergy medications I can take, but I have no problems whatsoever with Zyrtec. It helps me a lot on a daily basis. It doesn't take care of my allergies 100% on my very worst days, but it makes a huge difference in my everyday allergy problems, and I love it!""]"
[' 3-6 |  '],[' Male |  '],[' Condition: Other '],[' Overall rating 4.0 '],[],['My 4 year old has suddenly starting having mouth ulcers.  I recently went from 1/2 tsp to a full tsp and wondered if that had anything to do with it.  It could be totally unrelated; I was just thinking of recent changes.  Anyone have this problem?']
[' 45-54 |  '],[' Female |  '],[' Condition: Other '],[' Overall rating 2.7 '],"[""I've been taking OTC Zyrtec daily for about 10 months for year-round allergy symptoms.  Not only does it not work great on my itchy eyes and nose, I've gained weight, I'm tired all the time no matter how much sleep I get, I'm fatigued and have constant muscle weakness, I'm irritable, my blood pressure has gone up drastically to the point I started BP meds last week, I'm having weird dreams...it got to the point my doctor tested my thyroid function because my list of symptoms fit hypothyroidism a"", ""ll the way down the line. My thyroid test was normal - on the low end, actually. I started researching what else could cause my symptoms and stumbled across this forum. I won't be taking Zyrtec again and hope I feel more like the old me in a couple of days. Thanks to all of you who posted your side effects - it is such a comfort to know I'm not really losing my mind and this drug may be causing my problems!""]",[]
[' 25-34 |  '],[' Female |  '],[' Condition: Non-Seasonal Allergic Runny Nose '],[' Overall rating 2.3 '],"['I took the generic version of Zyrtec for about a month and developed laryngeal dystonia, also known as spasmotic dysphonia, which causes spasms of the muscles of the larynx or voice box.  I ended up being seen by the ear, nose and throat doctor and a neurologist before getting diagnosed.  I have spasms of the larynx, which makes it difficult to talk and sometimes even swallow.  I abruptly stopped the medication once the neurologist figured out what was causing the dystonia, but it has been 2 1/2', ' weeks and the spasms continue.  I now have been prescribed anti-parkinson meds to try to stop the spasms.  Hopefully the spasms will go away, but I am told it can be permanent.  I also noticed the difficulty concentrating while taking the medication.  ']",[]
[' 3-6 |  '],[' Male |  '],[' Condition: Inflammation of the Nose due to an Allergy '],[' Overall rating 3.3 '],"[""My 4 1/2 year old son has been on this drug for almost 2 years for year-round allergies. He was having many behavioral issues, not sleeping and wetting the bed. Physical complaints and depression. Pretty much a constant stress. After looking into other children's experiences (2 years too late...) ours was not the only one suffering from what seemed to be abnormal behavior while on Zyrtec. We've modified diet and made some habit changes, taken him off Zyrtec, and he's a new little man. I'd rather"", "" deal with allergies differently than put him on this. I'm sad I didn't look into this sooner. It's not the terrible 2's, 3's or 4's- it's the drug!""]",[]
[' 35-44 |  '],[' Female |  '],[' Condition: Other '],[' Overall rating 4.3 '],[],"['I suffer from full body ""narcotic itch"". I had a hysterectomy and no matter what opioid painkiller was given to me I wanted to scratch myself to death. Tried loratedine & diphenhydramine with very minor relief. Was discharged from the hospital, got Zyrtec on the way home, and happy ever since - unless you take 2 percoset 10/650mg post 12hr mark of taking Zyrtec...Read that Zyrtec was more effective with ""narcotic itch"" on other OB-GYN info sites as well.   ']"
[' 65-74 |  '],[' Female |  '],[' Condition: Persistent Hives of Unknown Cause '],[' Overall rating 5.0 '],[],['Stopped the hives immediately']
[' 75 or over |  '],[' Male |  '],[' Condition: Seasonal Runny Nose '],[' Overall rating 5.0 '],[],[]
[' 75 or over |  '],[' Female |  '],[' Condition: Seasonal Runny Nose '],[' Overall rating 4.3 '],[],['Allergy']
[' 45-54 |  '],[' Female |  '],[' Condition: Persistent Hives of Unknown Cause '],[' Overall rating 3.0 '],"[""Allergist had me try this medication for a rash that the cause can not be found yet.  It's easy to remember to take because it's only once daily.  My rash seems to be dormant.  I'm still itching, though it's a lot less than when I first went to the Dr. I still seem to have breakouts but I am also trying to narrow down what the cause may be from.  Allergy tests only showed a couple of things that I am allergic to.  I've only been on this medication for a short time I think and have gained close t"", ""o 10 pounds!  I don't understand why. I normally stay pretty close to the same weight all the time! I was glad to see that there are others out there that are having the same issues.""]",[]
[' 35-44 |  '],[' Female |  '],[' Condition: Inflammation of the Nose due to an Allergy '],[' Overall rating 4.3 '],[],"['As i got older i developed seasonal allergies and allergies to my pets which stay inside. After trying other types of allergy medicines i tried zyrtec and it worked. I now take the generic brand which works just as well. I also have to watch what kind of allergy meds i take with my blood pressure med, so it works for me. I really dont seem to have any weird dreams or major side affects.']"
[' 45-54 |  '],[' Male |  '],[' Condition: Inflammation of the Nose due to an Allergy '],[' Overall rating 4.3 '],[],"['In Europe, had bad reaction to feathers and dust in hotel.  Took the otc version, called Cetirizina there.  No side effects.  Significant relief.  Taking it only for this occasion - no intent to take regularly.']"
[' 25-34 |  '],[' Female |  '],[' Condition: Seasonal Runny Nose '],[' Overall rating 3.7 '],"['my 8 yr old son has been taking it for about a year and it worked really well on his cough and runny nose but he complained of his heart hurting lately so i took him off the med. and in a day of not taking it his heart has quit hurting and he said he doesnt have bad nightmares anymore which i didnt know was from the med. until reading all the other reviews so thank you he will never take it again i feel so bad for giving it to him but it worked really well but side affects like that arent worth ', 'it so i dont know what to give him now he only took it during winter months also ']",[]
[' 45-54 |  '],[' Female |  '],[' Condition: Inflammation of the Nose due to an Allergy '],[' Overall rating 2.3 '],[],"[""After taking this medication for 3 weeks, I found it to be minimally effective.  Would have continued to give it a chance, but gained 4 1/2 pounds and appetite increased dramatically.  Also had at least 3 really weird nightmares a night.  Felt tired all the time.  Considering the cost, it just didn't seem worth it to give it more of a chance.  Was really concerned about the effect of the weight gain on my blood pressure.""]"
[' 55-64 |  '],[' Male |  '],[' Condition: Inflammation of the Nose due to an Allergy '],[' Overall rating 5.0 '],[],"['I have had allergy/sinus issues for many years.  I would take over the counter nose sprays with which I developed an increased dependency to (not good.)  Zyrtec at first made me drowsy, but that stopped.  I take in the evening before bed and am fine.  My nose does get dry occasionally, but I take care of that with saline mist if it becomes troublesome.  This product has proved to be a very effective as it treats my allergy and sinus related issues very effectively.  ']"
[' 55-64 |  '],[' Female |  '],[' Condition: Seasonal Runny Nose '],[' Overall rating 1.7 '],[],['took 10mg at 10pm.  slept 12 hours and still had incredible desire to go back to sleep.  also absolutely no relief from symptoms.  will be returning product for full refund on Friday.  advice to people who do not live to take medicine - leave this on the shelf. you will totally regret ever trying it.']
[' 13-18 |  '],[' Male |  '],[' Condition: Other '],[' Overall rating 4.3 '],[],['just saying that this is not by perscription anymore....']
[' 45-54 |  '],[' Female |  '],[' Condition: Inflammation of the Nose due to an Allergy '],[' Overall rating 2.3 '],[],"['After being on Claritin for over a year, my twelve year old son was still having allergy issues so my doctor thought he should try Zyrtec. Zyrtec was effective for the sneezing, but this drug gave him abdominal pain and nausea. Be careful using it in kids.  This is a side effect in children. We are now using a nasal steroid spray, and my son has stopped having headaches with pressure behind the eyes.']"
[' 55-64 |  '],[' Female |  '],[' Condition: Non-Seasonal Allergic Runny Nose '],[' Overall rating 5.0 '],[],"['I live in Florida and there is always something in bloom here. I started taking Zyrtec at the advice of my Allergic and I have had no side affects what so ever. It clears my head and nose and makes my life bearable!Now I do not take it everyday ,but only as needed. When I need it it works! I do take a lot of other medications and there is no interactions with them. I have been taking Zyrtec for over a year now and would recommend it to anyone with allergy problems.']"
[' 65-74 |  '],[' Female |  '],[' Condition: Non-Seasonal Allergic Runny Nose '],[' Overall rating 3.0 '],[],[]
[' 45-54 |  '],[' Female |  '],[' Condition: Hives '],[' Overall rating 3.7 '],"['I had noticed the dreams but did not connect it to the zyrtec, however, I never used to dream. I do not have bad dreams though.  Irritable...yes.  I have been having a lot of hair loss and was wondering if anyone else was having this problem.  I had so much hair that I thought I would never have to worry about losing it. I have a noticable bald spot right in the top of my head. At first I just accepted that it was from wearing a ponytail for so many years. I have been taking zyrtec for three yea', 'rs for hives and I did not have hair loss before. ']",[]
[' 45-54 |  '],[' Female |  '],[' Condition: Hives '],[' Overall rating 5.0 '],[],"[""This is the only treatment that is effective on my hives. I've been tested and retested. Used several different med's. This is the only one that works for me.""]"
[' 65-74 |  '],[' Female |  '],[' Condition: Inflammation of the Nose due to an Allergy '],[' Overall rating 5.0 '],[],"[""No other allergy medication has worked as well for me as Zyrtec. I don't get drowsy from it, but I take it before I go to sleep at night. It doesn't interfere with any of my other medications.""]"
[' 55-64 |  '],[' Female |  '],[' Condition: Other '],[' Overall rating 2.0 '],"['I have been on Anti Histamines most of my life, as I suffer from numerous allergies.I bought zyrtec one day on special and what a disaster.  First I did not know what was wrong with me, I could not think straight, could not concentrate,weird dreams, terrible fatigue, did not want to wake up (and I am a morning person). I have not taken this tablet for 2 nights and feeling 100% better, although having trouble sleeping, but I am hoping this will pass as the tablet wears off.  Yes the Zyrtec is eff', 'ective is compating alergy problems BUT DO NOT TAKE IT. If you do please be aware of the side effects.']",[]
[' 19-24 |  '],[' Female |  '],[' Condition: Seasonal Runny Nose '],[' Overall rating 5.0 '],[],"['I am allergic to cat dander and have seasonal allergies. My allergies include itchy nose and eyes, sneezing and runny nose. Zyrtec works very fast for me, and I only take it when I have symptoms. I have noticed that I am very very tired after taking it though.  ']"
[' 3-6 |  '],[' Male |  '],[' Condition: Seasonal Runny Nose '],[' Overall rating 2.7 '],[],"['After finding Claritin unsuccessful for my 4 year old son, I switched him to Zyrtec.   He underwent an awful mood change, and his behavior was unrecognizable. He was angry, threw things, and cried for no reason at all. After 2 days on Zyrtec, we are done. Never again. ']"
[' 25-34 |  '],[' Female |  '],[' Condition: Inflammation of the Nose due to an Allergy '],[' Overall rating 5.0 '],[],"[""Had daily headaches, had tried claritin before and it hadn't helped, also had been on nasal sprays. I started taking Zyrtec and I haven't had a headache since. The pressure in my sinuses is all gone too. It's fabulous and you only have to take it once a day, and there are no side effects for me, not even drowsiness. Love it!""]"
[' 45-54 |  '],['  '],[' Condition: Other '],[' Overall rating 3.0 '],[],"[""It doesn't seem to work for me.  I still have runny nose, stuffy nose, sneezing, tingling in nose.""]"
[' 25-34 |  '],[' Male |  '],[' Condition: Inflammation of the Nose due to an Allergy '],[' Overall rating 5.0 '],"[""I have been on Zyrtec for several years now for nasal allergies. I use it in conjunction with my nasal spray (fluticasone), and the two complement each other beautifully -- the corticosteroid takes care mostly of the inflammation component and zyrtec/cetirizine wipes out the itching and sneezing component. This has been a very useful drug for my allergies, and I wholeheartedly recommend it to anyone seeking relief from allergies. A few things to know: this is *not* a decongestant, it's just an H"", '1 blocker. What that means is that if your nose is all stuffed up due to allergies, it won\'t declog just by taking this drug. The antihistamine though *will* help calm down the itchiness and sneezing usually associated with allergies, and it will likely do that very effectively! If you also need help with decloging your nasal airways, you should either use the ""D"" concoction (with a decongestant), or use a corticosteroid spray. The latter is under Rx. There are plenty available out there that are very effective and pretty safe if used correctly. Talk to your doctor!  Also this drug tends to dry me up. Make sure you drink plenty of fluids.']",[]
[' 25-34 |  '],[' Female |  '],[' Condition: Seasonal Runny Nose '],[' Overall rating 3.3 '],"[""I am a person who is very in tune with her body and the signs.    It seemed to dry my nose up. ... worked great for turning that around for me.  However, it was as if the chemical in my brain said eat eat eat. And that's all I felt like doing.  And never felt full.  This is not like me.  I've put on 8 pounds in 2 weeks!  I just got off the pills 2 days ago and am not as groggy and hard to wake in the morning (I took one pill b/4 bedtime)and the 1st day after not taking one, the need to constantl"", ""y eat was gone.  I have NEVER been on any med. that has done this to me.  I don't recommend it soley for that reason.  It's just not worth it to me. Maybe I will just go in for a shot when my hay fever acts up and put up with seasonal allergies the rest of the time.  ... Also had headaches.""]",[]
[' 55-64 |  '],[' Female |  '],[' Condition: Non-Seasonal Allergic Runny Nose '],[' Overall rating 3.3 '],[],"['After taking Zyrtec 10mg daily for several weeks, I noticed:  constant irritability, sleepiness during the day, wakefulness at night, nausea, headache, weight gain around my waist (no change in diet or exercise) and mild depression.  Read reviews and stopped Zyrtec last week.  Most symptoms went away in the first few days; the weight is coming off gradually.  Now I just sneeze and blow my nose frequently -- better than the side effects.']"
[' 25-34 |  '],[' Female |  '],[' Condition: Seasonal Runny Nose '],[' Overall rating 5.0 '],[],['I have been taking this medication for about 2 years and along with allergy shots my life has improved so much!  I was always miserable due to daily allergies.  This medication has really changed my life and helped me enjoy it so much more!']
[' 13-18 |  '],[' Female |  '],[' Condition: Other '],[' Overall rating 5.0 '],[],"[""I have horrible seasonal allergies and this completely wipes them out. I've never had any side effects. I can take it in the middle of the day without getting drowsy. Love it!!!""]"
[' 45-54 |  '],[' Female |  '],[' Condition: Seasonal Runny Nose '],[' Overall rating 4.0 '],[],[]
[' 13-18 |  '],[' Male |  '],[' Condition: Other '],[' Overall rating 4.7 '],[],"['I use Zyrtec because of my overly exaggerated histamine release to mosquito bites and it works great. Although it does not get rid of the red inflammation completely, it takes away the itchiness and size of the bumps. So, overall I would have to give it a solid A grade.']"
[' 75 or over |  '],[' Male |  '],[' Condition: Other '],[' Overall rating 4.3 '],[],"[""I wasn't sure what it was that was giving  me an irritated throat, then coughing up of  white phlegm that stopped the tickle after  a few minutes. I assumed allergy and took a Zyertec tablet at 12:00 AM. It is now 1:13 AM and much, to my relief Zyertec,has   helped.      ""]"
[' 65-74 |  '],[' Male |  '],[' Condition: Non-Seasonal Allergic Runny Nose '],[' Overall rating 4.3 '],[],"[""really has helped alot however i'm having joint pain could this be a side effect?""]"
[' 25-34 |  '],[' Female |  '],[' Condition: Other '],[' Overall rating 5.0 '],[],"['Decided to start using this because I felt before was too much even with my nasal spay.  Was pretty much no longer affected for me use since I was using it along with d as well.  In the end thought I decided it was time to go back on it, but this time I did ask the pharmacist at the store what it thought of it.  Also using it along D as well.  It said it really no need to use both and since I use it in combination with the nasal spay as well.   ']"
[' 55-64 |  '],[' Female |  '],[' Condition: Persistent Hives of Unknown Cause '],[' Overall rating 5.0 '],[],['I have had hives that come and go for over 3 years. this medication works well. but I would like to know if anyone on this drug has had any problems with blood pressure. ']
[' 25-34 |  '],[' Female |  '],[' Condition: Other '],[' Overall rating 4.7 '],"['I changed from claritin d to zyrtec and it made a huge improvement immediately on my allergies. I am allergic to lots of things, and i also take singulair. the combination works great, and i have been on zyrtec now for about 8 months. i do have frequent headaches and not sure if its due to the meds or not...just the last month i have started having difficulty sleeping, very wierd dreams, and extreme fatigue, even on the days when i DID sleep all night. nothing else has changed, no stress, nothin', ""g unusual, so I am thinking it may be the meds after some of these reviews. when i skip the zyrtec for a few nights, it does get better but then i start coughing and sneezing often, so i don't know which is worse. Not sure what i am going to do, maybe try other allergy meds.  ""]",[]
[' 75 or over |  '],[' Female |  '],[' Condition: Seasonal Runny Nose '],[' Overall rating 2.0 '],[],['Causes severe dizziness and upset stomach.']
[' 45-54 |  '],[' Female |  '],[' Condition: Hives '],[' Overall rating 3.3 '],[],['i dont itch as much or break out in hives as much but i do still have some ']
[' 25-34 |  '],[' Female |  '],[' Condition: Inflammation of the Nose due to an Allergy '],[' Overall rating 3.0 '],[],"[""I was on this for 3 weeks.  During that time I started to suffer from depression, irritability and wild mood swings.  I also noticed that I had an insatiable appetite even though I couldn't possibly be hungry.  Finally, I put two and two together after not feeling like myself for almost the entire time I was on the stuff.  I now feel back to almost normal.  I do not recommend this drug.  ""]"
[' 55-64 |  '],[' Female |  '],[' Condition: Inflammation of the Nose due to an Allergy '],[' Overall rating 4.0 '],[],"['slightly dry mouth and nose, but scratchy throat is gone. ']"
[' 13-18 |  '],[' Female |  '],[' Condition: Inflammation of the Nose due to an Allergy '],[' Overall rating 4.7 '],[],['This medicine works well. Although it may cause some seropis drowsiness. I strongly reccomend that you take before bed. Note: This is medication will work for all allergy symptoms. ']
[' 7-12 |  '],[' Female |  '],[' Condition: Non-Seasonal Allergic Runny Nose '],[' Overall rating 2.3 '],[],"['Caused outbursts of anger, aggression, restlessness. Horrid behavior, uncontrolled actions.']"
[' 75 or over |  '],[' Male |  '],[' Condition: Non-Seasonal Allergic Runny Nose '],[' Overall rating 4.0 '],[],['I am diabeticnd the Zyrtec appears to affect my diabetes control']
[' 75 or over |  '],[' Male |  '],[' Condition: Non-Seasonal Allergic Runny Nose '],[' Overall rating 2.3 '],[],['It has Not affected my Nose Drip']
[' 75 or over |  '],[' Female |  '],[' Condition: Inflammation of the Nose due to an Allergy '],[' Overall rating 4.3 '],[],"['It does make me sleepy.  I feel that it is the best allergy medicine that I have taken.  If I stop taking it for a time, I usually feel a reason to start it again.   I take it at bedtime.      ']"
